组织机构代码,单位名称,行政区划,行业代码,管理机构,项目编码,项目名称,本年商品房销售面积_合计
52463330,佛山市达磐恒房地产开发有限公司,440604012054（同华社区居委会）,7010,4.40604E+11,52463330001,达磐恒,0
53734518,绿地集团佛山禅城置业有限公司,440604012202（镇安村民委员会）,7010,4.40604E+11,53734518001,禅城绿地中心,0
06512723X,广东星域房地产开发有限公司,440604012065（同兴社区居委会）,7010,4.40604E+11,06512723X001,星星广场,5555
66692871,佛山市德富恒辉房地产开发有限公司,440604012002（佛平北社区居委会）,7010,4.40604E+11,66692871001,佛山市禅城区祖庙街道晒莨地1号文庆桥东侧地块项目,0
70269558,佛山市兴发房地产开发有限公司,440604100005（绿岛社区居委会）,7010,4.40604E+11,70269558001,兴发大厦,555
07193306X,佛山高佛置地商业有限公司,440604012006（城北社区居委会）,7010,4.40604E+11,07193306X001,金谷国际五金交易中心,555
07351108X,佛山市禅城区越辉房地产开发有限公司,440604012047（普西社区居委会）,7010,4.40604E+11,07351108X001,南浦村项目,2255
90159831,佛山铂晟置业有限公司,440604011011（白坭村民委员会）,7010,4.40604E+11,90159831001,绿地未来城,5555
